{
  "miner": "review-delta-miner",
  "run_url": "https://github.com/example-org/agent-ops/actions/runs/00000000004",
  "lookback_days": 9,
  "created_at": "2026-08-31T12:00:00Z",
  "findings": [
    {
      "id": "f-01-review-requested-changes",
      "kind": "human-correction",
      "summary": "Human reviewer approved without comment on example-app-core PR #999; agent's new store path merged unchanged.",
      "evidence": [
        {
          "url": "https://github.com/example-org/example-app-core/pull/999#pullrequestreview-1111111111",
          "note": "Review state: APPROVED. Body: 'lgtm, tests read well.' No change requests, no unresolved comments."
        },
        {
          "url": "https://github.com/example-org/example-app-core/pull/999",
          "note": "PR merged with agent's original commits; zero human commits on the branch."
        }
      ],
      "prevalence": { "occurrences": 1, "distinct_sources": 1 },
      "proposed_change": {
        "change_type": "team-memory-entry",
        "target_path": ".claude/team-memory/store-path-tests.md",
        "detail": "Note: the store path pattern the agent used cleared review with no changes; keep as reference pattern.",
        "risk_if_wrong": "Codifying a one-off approval as a durable pattern could lock in an accidental convention."
      }
    }
  ]
}
